{
  "annotations": [
    {
      "annotationId": "artifact-note",
      "artifactRole": "after",
      "candidateDigest": "sha256:3dbcc10cea8d6d22acd2ec656656675ba858d995d66cff87644aae77baaaaee2",
      "category": "small-size",
      "comment": "Review the complete after artifact at the target size.",
      "pngDigest": "sha256:91c35429c3e0547842b113c93e23f42676ba579030153b248c06b06c0d1c38a1",
      "scope": {
        "kind": "artifact"
      },
      "severity": "note",
      "visualEvidenceDigest": "sha256:52a369511a59955bf5153e0f3f0259a38818a18084e1c8480a4e1aadd448c799"
    },
    {
      "annotationId": "region-note",
      "artifactRole": "baseline",
      "candidateDigest": "sha256:8f209d0c7530e088102db27f550e995073af6b90b2d8bacc67831f6240a19e68",
      "category": "alignment",
      "comment": "Inspect align / center in this normalized region.",
      "pngDigest": "sha256:91c35429c3e0547842b113c93e23f42676ba579030153b248c06b06c0d1c38a1",
      "scope": {
        "heightMillionths": 400000,
        "kind": "region",
        "widthMillionths": 400000,
        "xMillionths": 100000,
        "yMillionths": 100000
      },
      "severity": "minor",
      "visualEvidenceDigest": "sha256:60b0390b50829c816ddc07ccc4f1bc40d0a36eccb5f992a2db54d3eba96b87a3"
    }
  ],
  "briefDigest": "sha256:9ffa909b428e21dd78db8730780cebaa006707828c47e888a715cb5249d16af4",
  "candidateDigests": [
    "sha256:3dbcc10cea8d6d22acd2ec656656675ba858d995d66cff87644aae77baaaaee2",
    "sha256:8f209d0c7530e088102db27f550e995073af6b90b2d8bacc67831f6240a19e68"
  ],
  "dispositions": [
    {
      "candidateDigest": "sha256:3dbcc10cea8d6d22acd2ec656656675ba858d995d66cff87644aae77baaaaee2",
      "disposition": "preferred"
    },
    {
      "candidateDigest": "sha256:8f209d0c7530e088102db27f550e995073af6b90b2d8bacc67831f6240a19e68",
      "disposition": "needs-revision"
    }
  ],
  "overallDisposition": {
    "candidateDigest": "sha256:8f209d0c7530e088102db27f550e995073af6b90b2d8bacc67831f6240a19e68",
    "kind": "needs-revision"
  },
  "reviewDigest": "sha256:af2136f062a871b040f0f7631a7b3e6291d8ab50323cb16844e1b7d877d07886",
  "schema": "tfsb.design-review",
  "schemaVersion": 1,
  "summary": "Candidate A is preferred; candidate B needs-revision for the profile: compact alignment."
}
